{
  "$schema": "https://json-schema.org/draft/2020-12/schema",
  "$id": "https://github.com/otheru-ai/ember/blob/main/share/model_cards/_schema.json",
  "title": "Ember model card sidecar",
  "description": "Optional sidecar selected with --model-card. Supplies model-specific output limits, sampler defaults, a thinking terminator hint, reasoning-effort budgets, and advisory context-extension provenance.",
  "type": "object",
  "additionalProperties": false,
  "required": ["name", "source", "verified_at", "max_tokens"],
  "properties": {
    "name": {
      "type": "string",
      "description": "Display name used for provenance."
    },
    "source": {
      "type": "string",
      "format": "uri",
      "description": "Upstream model card from which the defaults were transcribed."
    },
    "verified_at": {
      "type": "string",
      "format": "date",
      "description": "ISO 8601 date on which the values were checked against the source."
    },
    "max_tokens": {
      "type": "integer",
      "minimum": 1,
      "description": "Default combined reasoning and visible-output token cap."
    },
    "hard_limit_reply_budget": {
      "type": "integer",
      "minimum": 0,
      "description": "Tokens reserved after `</think>` for visible output. When the remaining budget reaches this reserve during thinking, Ember injects `thinking_terminator_hint`. The DeepSeek fallback is 1024."
    },
    "thinking_terminator_hint": {
      "type": "string",
      "description": "Directive injected verbatim when the thinking budget hook fires. Include `</think>` when the hint must force the transition to visible output. An empty string disables injection."
    },
    "sampling": {
      "type": "object",
      "description": "Sampler defaults used when the request omits the corresponding field.",
      "additionalProperties": false,
      "properties": {
        "temperature":        { "type": "number", "minimum": 0, "maximum": 2 },
        "top_p":              { "type": "number", "minimum": 0, "maximum": 1 },
        "top_k":              { "type": "integer", "minimum": 0 },
        "min_p":              { "type": "number", "minimum": 0, "maximum": 1 },
        "presence_penalty":   { "type": "number", "minimum": -2, "maximum": 2 },
        "repetition_penalty": { "type": "number", "exclusiveMinimum": 0 }
      }
    },
    "reasoning_effort_tiers": {
      "type": "object",
      "description": "Per-tier reasoning budgets, clamped so the visible-output reserve remains available.",
      "additionalProperties": false,
      "properties": {
        "low":    { "type": "integer", "minimum": 0 },
        "medium": { "type": "integer", "minimum": 0 },
        "high":   { "type": "integer", "minimum": 0 },
        "x-high": { "type": "integer", "minimum": 0 },
        "max":    { "type": "integer", "minimum": 0 }
      }
    },
    "context_extension": {
      "type": "object",
      "description": "Advisory static-YaRN recipe. A sidecar never activates scaling; the operator must pass the architecture-specific CLI opt-in and exact context.",
      "additionalProperties": false,
      "required": ["type", "native_context", "max_context", "factor", "enabled_by_default"],
      "properties": {
        "type": { "const": "static_yarn" },
        "native_context": { "type": "integer", "minimum": 1 },
        "max_context": { "type": "integer", "minimum": 1 },
        "factor": { "type": "number", "exclusiveMinimum": 1 },
        "enabled_by_default": {
          "const": false,
          "description": "Static YaRN must remain an explicit operator opt-in because it also changes short-context inference."
        },
        "source": {
          "type": "string",
          "format": "uri",
          "description": "Immutable upstream recipe provenance."
        }
      }
    },
    "notes": {
      "type": "string",
      "description": "Provenance, caveats, or measured deviations from the upstream card."
    }
  }
}
