{
  "name": "Qwen3.8-Flash-Next",
  "source": "https://huggingface.co/Qwen/Qwen3.8-Flash-Next/tree/f5d08274bafd880402bd16f5e3e6c514136ec06c",
  "verified_at": "2026-08-26",
  "max_tokens": 262144,
  "hard_limit_reply_budget": 131072,
  "thinking_terminator_hint": "</think>\n\n",
  "sampling": {
    "temperature": 1.0,
    "top_p": 0.95,
    "top_k": 20,
    "min_p": 0.0,
    "presence_penalty": 0.0,
    "repetition_penalty": 1.0
  },
  "reasoning_effort_tiers": {
    "low": 32768,
    "medium": 131072,
    "high": 262144,
    "x-high": 262144,
    "max": 262144
  },
  "context_extension": {
    "type": "static_yarn",
    "native_context": 262144,
    "max_context": 1000000,
    "factor": 4.0,
    "enabled_by_default": false,
    "source": "https://huggingface.co/Qwen/Qwen3.8-Flash-Next/blob/f5d08274bafd880402bd16f5e3e6c514136ec06c/README.md"
  },
  "notes": "Pinned to the official model revision above. Thinking-mode sampling defaults are temperature=1.0, top_p=0.95, top_k=20, min_p=0, presence_penalty=0 and repetition_penalty=1. The official 1M-context guidance allocates up to 262144 reasoning tokens plus 131072 final-response tokens; Ember still clamps both to actual context room. Static factor-4 YaRN is advisory and off by default; it requires the explicit runtime opt-in and is not yet certified to fit or perform on a 128 GiB Strix Halo UMA host. Qwen only accepts low, medium and xhigh reasoning-effort names at the prompt ABI. Non-thinking requests should explicitly use the official 0.7/0.8/20 sampling settings and presence_penalty=1.5; a single sidecar cannot select sampler defaults conditionally."
}
